{
  "$schema": "https://json-schema.org/draft/2020-12/schema",
  "$id": "04-gaps",
  "title": "GAP-DETECT output — blast-ranked gaps with interpretations and disposition",
  "type": "object",
  "required": ["extraction_ref", "class", "gaps", "dismissed_unknowns", "gap_counts"],
  "properties": {
    "extraction_ref": { "type": "string", "description": "path to 02-extraction.json" },
    "grounding_ref": { "description": "path string if 03-grounding/ was read, else null", "oneOf": [{"type":"string"},{"type":"null"}] },
    "class": { "type": "string", "description": "greenfield | feature-add | bugfix" },
    "baseline_map_ref": { "description": "brownfield only: path to baseline-map.json; null for greenfield", "oneOf": [{"type":"string"},{"type":"null"}] },
    "baseline_aprd_ref": { "description": "brownfield only: path to aprd.frozen.md; null for greenfield", "oneOf": [{"type":"string"},{"type":"null"}] },
    "gaps": {
      "type": "array",
      "description": "sorted architecture → scope → cosmetic",
      "items": {
        "type": "object",
        "required": ["id", "gap", "refs", "interpretations", "recommended_default", "blast_radius", "disposition", "reason"],
        "properties": {
          "id": { "type": "string", "pattern": "^G[0-9]+$", "description": "stable gap id; G* contiguous from G1, never renumbered" },
          "gap": { "type": "string", "description": "one line: the ambiguity framed as a fork, not the answer; a place a competent engineer could build two different things" },
          "refs": { "type": "array", "items": { "type": "string", "description": "extraction id (R*, U*, E*) the gap directly arises from" }, "minItems": 1, "description": "non-empty list of extraction ids the gap directly arises from" },
          "seam_ref": { "description": "feature-add optional: {at:C*, contract_ref:CT*} when fork sits at an integration seam; null otherwise", "oneOf": [{"type":"null"},{"type":"object","properties":{"at":{"type":"string","description":"component id at the seam"},"contract_ref":{"type":"string","description":"contract id CT* at the seam"}}}] },
          "interpretations": { "type": "array", "items": { "type": "string", "description": "one concrete, buildable, mutually-exclusive interpretation" }, "minItems": 2, "description": ">=2 concrete mutually-exclusive buildable interpretations" },
          "recommended_default": { "type": "string", "description": "verbatim copy of one interpretation; the least-surprise reading adopted absent a client answer" },
          "blast_radius": { "type": "string", "enum": ["architecture","scope","cosmetic"], "description": "impact tier: architecture | scope | cosmetic" },
          "disposition": { "type": "string", "enum": ["ask","assume"], "description": "ask iff blast_radius in {architecture, scope}; assume iff cosmetic — deterministic from blast_radius" },
          "reason": { "type": "string", "description": "why the two builds diverge AND why this blast tier" }
        }
      }
    },
    "dismissed_unknowns": {
      "type": "array",
      "description": "every U* not cited in any gap's refs; may be [] only if every unknown fed a gap",
      "items": {
        "type": "object",
        "required": ["id", "reason"],
        "properties": {
          "id": { "type": "string", "pattern": "^U[0-9]+$", "description": "unknown id from extraction" },
          "reason": { "type": "string", "description": "why this unknown is not a build-divergence gap" }
        }
      }
    },
    "gap_counts": {
      "type": "object",
      "description": "integer tallies; total == gaps.length; tier sums must match",
      "required": ["architecture", "scope", "cosmetic", "total"],
      "properties": {
        "architecture": { "type": "integer", "minimum": 0, "description": "count of architecture-blast-radius gaps" },
        "scope": { "type": "integer", "minimum": 0, "description": "count of scope-blast-radius gaps" },
        "cosmetic": { "type": "integer", "minimum": 0, "description": "count of cosmetic-blast-radius gaps" },
        "total": { "type": "integer", "minimum": 0, "description": "total gap count; must equal gaps.length and architecture + scope + cosmetic" }
      },
      "x-walk": "total == gaps.length; architecture + scope + cosmetic == total"
    }
  }
}
